Date,Transaction_code,Details,Ref,Cheque,Debit,Credit,Balance
2024-12-19,,ACCOUNT MAINTENANCE FEE FROM 01/07/2024TO 31/12/2024,,nan,500.0,0.0,250381.59
2024-12-19,,15% VAT ON A/C MAINTENANCE FEE FROM01/07/2024 TO 31/12/2024,,nan,75.0,0.0,250306.59
2024-12-19,,SMS Service charge for the year 2024,,nan,100.0,0.0,250206.59
2024-12-19,,VAT on SMS Service charge for the year 2024,,nan,15.0,0.0,250191.59
2024-12-30,,EXCISE DUTY FOR CREDIT BALANCE FROM01/01/2024 TO 31/12/2024,,nan,150.0,0.0,250041.59
2025-06-26,,ACCOUNT MAINTENANCE FEE FROM 01/01/2025TO 30/06/2025,,nan,500.0,0.0,249541.59
2025-06-26,,15% VAT ON A/C MAINTENANCE FEE FROM01/01/2025 TO 30/06/2025,,nan,75.0,0.0,249466.59
