Date,Transaction_code,Details,Ref,Cheque,Debit,Credit,Balance
2023-12-21,,SMS Service charge for the year 2023,,nan,100.0,0.0,252196.59
2023-12-21,,VAT on SMS Service charge for the year 2023,,nan,15.0,0.0,252181.59
2023-12-21,,ACCOUNT MAINTENANCE FEE FROM 01/07/2023TO 31/12/2023,,nan,500.0,0.0,251681.59
2023-12-21,,15% VAT ON A/C MAINTENANCE FEE FROM01/07/2023 TO 31/12/2023,,nan,75.0,0.0,251606.59
2023-12-28,,EXCISE DUTY FOR CREDIT BALANCE FROM01/01/2023 TO 31/12/2023,,nan,150.0,0.0,251456.59
2024-06-26,,ACCOUNT MAINTENANCE FEE FROM 01/01/2024TO 30/06/2024,,nan,500.0,0.0,250956.59
2024-06-26,,15% VAT ON A/C MAINTENANCE FEE FROM01/01/2024 TO 30/06/2024,,nan,75.0,0.0,250881.59
